{
  "$schema": "../schemas/asset-governance.schema.json",
  "schemaVersion": "opensoha.dev/skills-asset-governance/v1",
  "version": "0.1.0",
  "releaseSigning": {
    "provenanceRequired": true,
    "attestationProvider": "github-actions-attest-build-provenance",
    "signedArtifacts": [
      "releaseTarball",
      "checksum",
      "manifest",
      "validationReport",
      "githubBuildProvenance"
    ],
    "verification": "Verify the GitHub build provenance attestation, release manifest, checksum file, validation report, and embedded package manifest before activating a skills runtime."
  },
  "permissionReview": {
    "reviewedAt": "2026-07-14",
    "reviewer": "opensoha-maintainers",
    "assets": [
      {
        "type": "skill",
        "id": "evaluation-release-gate-reviewer",
        "version": "0.1.0",
        "riskLevel": "high",
        "approvalRequired": true,
        "gatewayCapabilityRefs": [
          "gateway.manifest.read",
          "delivery.execution_tasks.list",
          "delivery.execution_logs.list"
        ],
        "httpCapabilityRefs": [
          "evaluation.run.execute",
          "evaluation.replay.create",
          "evaluation.gate.evaluate"
        ],
        "platformCapabilityRefs": [],
        "requiredScopes": [
          "aiClient",
          "skill",
          "application",
          "environment",
          "executionTask"
        ],
        "guardrails": [
          "explicit_approval",
          "read_only_replay",
          "gate_error_fails_closed",
          "redact_evaluation_secrets"
        ],
        "reviewStatus": "approved"
      },
      {
        "type": "skill",
        "id": "knowledge-connector-operator",
        "version": "0.1.0",
        "riskLevel": "execute",
        "approvalRequired": true,
        "gatewayCapabilityRefs": [
          "gateway.manifest.read",
          "knowledge.search"
        ],
        "httpCapabilityRefs": [
          "knowledge.connectors.list",
          "knowledge.connectors.create",
          "knowledge.connectors.validate",
          "knowledge.sync.start",
          "knowledge.sync.status",
          "knowledge.sync.cancel",
          "knowledge.sync.retry"
        ],
        "platformCapabilityRefs": [],
        "requiredScopes": [
          "aiClient",
          "skill"
        ],
        "guardrails": [
          "explicit_approval",
          "opaque_secret_refs",
          "ssrf_boundaries",
          "terminal_sync_evidence"
        ],
        "reviewStatus": "approved"
      },
      {
        "type": "skill",
        "id": "memory-privacy-curator",
        "version": "0.1.0",
        "riskLevel": "high",
        "approvalRequired": true,
        "gatewayCapabilityRefs": [
          "gateway.manifest.read"
        ],
        "httpCapabilityRefs": [
          "memory.inspect",
          "memory.delete"
        ],
        "platformCapabilityRefs": [],
        "requiredScopes": [
          "aiClient",
          "skill"
        ],
        "guardrails": [
          "explicit_approval",
          "verified_subject_scope",
          "deletion_propagation",
          "sensitive_content_minimization"
        ],
        "reviewStatus": "approved"
      },
      {
        "type": "skill",
        "id": "provider-rollout-operator",
        "version": "0.1.0",
        "riskLevel": "high",
        "approvalRequired": true,
        "gatewayCapabilityRefs": [
          "gateway.manifest.read",
          "delivery.execution_tasks.list",
          "delivery.execution_logs.list"
        ],
        "httpCapabilityRefs": [
          "agent.providers.rollout"
        ],
        "platformCapabilityRefs": [],
        "requiredScopes": [
          "aiClient",
          "skill",
          "application",
          "environment",
          "executionTask"
        ],
        "guardrails": [
          "explicit_approval",
          "provider_conformance",
          "active_run_drain",
          "lkg_rollback"
        ],
        "reviewStatus": "approved"
      },
      {
        "type": "skill",
        "id": "rag-quality-engineer",
        "version": "0.1.0",
        "riskLevel": "execute",
        "approvalRequired": true,
        "gatewayCapabilityRefs": [
          "gateway.manifest.read",
          "knowledge.search"
        ],
        "httpCapabilityRefs": [
          "knowledge.sync.status",
          "knowledge.rebuild"
        ],
        "platformCapabilityRefs": [],
        "requiredScopes": [
          "aiClient",
          "skill"
        ],
        "guardrails": [
          "explicit_approval",
          "fixed_query_set",
          "citation_evidence",
          "lkg_revision_preservation"
        ],
        "reviewStatus": "approved"
      },
      {
        "type": "skill",
        "id": "ai-evaluation-engineer",
        "version": "0.1.0",
        "riskLevel": "read",
        "approvalRequired": false,
        "gatewayCapabilityRefs": [
          "gateway.manifest.read",
          "delivery.execution_tasks.list",
          "delivery.execution_logs.list"
        ],
        "platformCapabilityRefs": [],
        "requiredScopes": [
          "aiClient",
          "skill",
          "application",
          "environment",
          "executionTask"
        ],
        "guardrails": [
          "read_only_evidence",
          "no_fabricated_evaluations",
          "runtime_manifest_gate",
          "redact_sensitive_logs"
        ],
        "reviewStatus": "approved"
      },
      {
        "type": "skill",
        "id": "delivery-developer",
        "version": "0.1.0",
        "riskLevel": "execute",
        "approvalRequired": true,
        "gatewayCapabilityRefs": [
          "delivery.applications.list",
          "delivery.applications.detail",
          "delivery.applications.create",
          "delivery.onboarding.analyze_repo",
          "delivery.standards.dockerfile.generate",
          "delivery.standards.dockerfile.validate",
          "delivery.standards.helm.generate",
          "delivery.standards.k8s.validate",
          "delivery.spec.render",
          "delivery.application.bootstrap",
          "delivery.drafts.create",
          "delivery.drafts.confirm",
          "delivery.application_environments.list",
          "delivery.application_services.list",
          "delivery.build_sources.list",
          "delivery.release_targets.list",
          "delivery.release_bundles.list",
          "delivery.execution_tasks.list",
          "delivery.execution_logs.list",
          "delivery.release.plan",
          "delivery.plans.create",
          "delivery.plans.confirm",
          "delivery.release_context.diff",
          "delivery.rollback.context",
          "delivery.actions.trigger",
          "delivery.workflows.create",
          "delivery.workflows.get",
          "delivery.batches.create",
          "delivery.batches.get",
          "delivery.batches.cancel",
          "delivery.batches.assess",
          "observability.metrics.assess"
        ],
        "platformCapabilityRefs": [],
        "requiredScopes": [
          "businessLine",
          "application",
          "environment"
        ],
        "guardrails": [
          "gateway_only",
          "approval_for_delivery_actions",
          "no_direct_runtime_access",
          "preserve_delivery_evidence"
        ],
        "reviewStatus": "approved"
      },
      {
        "type": "skill",
        "id": "delivery-tester",
        "version": "0.1.0",
        "riskLevel": "analyze",
        "approvalRequired": false,
        "gatewayCapabilityRefs": [
          "delivery.application_environments.list",
          "delivery.release_targets.list",
          "delivery.release_bundles.list",
          "delivery.execution_tasks.list",
          "delivery.execution_logs.list",
          "delivery.release.plan",
          "delivery.release_context.diff",
          "diagnosis.release_failure.analyze"
        ],
        "platformCapabilityRefs": [],
        "requiredScopes": [
          "application",
          "environment"
        ],
        "guardrails": [
          "read_only_delivery_evidence",
          "no_mutation",
          "minimal_failure_logs",
          "preserve_artifact_ids"
        ],
        "reviewStatus": "approved"
      },
      {
        "type": "skill",
        "id": "knowledge-curator",
        "version": "0.1.0",
        "riskLevel": "read",
        "approvalRequired": false,
        "gatewayCapabilityRefs": [
          "gateway.manifest.read",
          "knowledge.search"
        ],
        "platformCapabilityRefs": [],
        "requiredScopes": [
          "aiClient",
          "skill"
        ],
        "guardrails": [
          "knowledge_permission_checks",
          "explicit_mutation_scope",
          "opaque_secret_refs",
          "runtime_manifest_gate"
        ],
        "reviewStatus": "approved"
      },
      {
        "type": "skill",
        "id": "knowledge-researcher",
        "version": "0.1.0",
        "riskLevel": "read",
        "approvalRequired": false,
        "gatewayCapabilityRefs": [
          "gateway.manifest.read",
          "knowledge.search"
        ],
        "platformCapabilityRefs": [],
        "requiredScopes": [
          "aiClient",
          "skill"
        ],
        "guardrails": [
          "read_only_knowledge",
          "citation_required",
          "no_scope_broadening",
          "redact_sensitive_content"
        ],
        "reviewStatus": "approved"
      },
      {
        "type": "skill",
        "id": "compute-sre",
        "version": "0.1.0",
        "riskLevel": "read",
        "approvalRequired": false,
        "gatewayCapabilityRefs": [
          "compute.overview.read",
          "compute.resources.read",
          "compute.resource_relations.list",
          "compute.tasks.list",
          "compute.tasks.get",
          "compute.task_logs.list"
        ],
        "platformCapabilityRefs": [],
        "requiredScopes": [
          "computeDomain",